id,created_at,text
923548069651668992,2017-10-26 13:53:13,"Children worldwide send cards to beloved US television clown, felled by ""brain stroke"" and unable to communicate in… https://t.co/LKzYJruRuI"
923544058177425408,2017-10-26 13:37:16,"Venomous US reporter and sex harasser Mark Halperin remains under sentence of death, for vile anti-DPRK slanders.

https://t.co/lFNFpSqaRk"
923542666482249728,2017-10-26 13:31:44,"Readers of @DPRK_News urged to pledge any amount, no matter how small. Pledges above 100,000 Won will receive the complimentary tote bag."
923531159321108480,2017-10-26 12:46:01,"Supreme Leader Kim Jong-Un states that, while Leader has no firsthand evidence, US reporter Mark Halperin ""just loo… https://t.co/zEmKodePuK"
923299858483519488,2017-10-25 21:26:55,Failed US oligarch Hillary Clinton explains to Russian president Vladimir Putin that Uranium is 92nd element on per… https://t.co/D0sYLow2ad
923290280895418368,2017-10-25 20:48:51,"""I'm Just A Bill"" is US folksong decrying inefficiency of so-called democratic lawmaking process.

Every word of Ma… https://t.co/DZglboujpr"
923265393766125569,2017-10-25 19:09:57,Heroic actress thanks Marshal Kim Jong-Un for giving her courage to prove that George H.W. Bush is sex harasser. An… https://t.co/R6xbiuT9NB
923222854421839873,2017-10-25 16:20:55,"""Mystery Of The Turnip Used To Commit Murder"" is finally solved, by Supreme Leader Kim Jong-Un."
923217347535663104,2017-10-25 15:59:02,"""Amazon Key"" is new technology service in which thieves, stalkers, and perverts are delivered directly to homes of customers at no charge."
923187808830967809,2017-10-25 14:01:40,"""Halloween"" is western ritual day on which beleaguered peasants surrender food to masked terrorists in return for one year of peace."
923153434009919488,2017-10-25 11:45:04,Marshal Kim Jong-Un meeting with Workers Party delegates to Supreme Peoples Assembly described as festival of dignified enthusiasm.
923148286260805634,2017-10-25 11:24:37,"Supreme Leader Kim Jong-Un has dossier on Donald Trump, ten times more powerful than that of Hillary Clinton or Jebulon Bush."
922930936223846400,2017-10-24 21:00:57,"New Zealand premier, admitting capitalism and space exploration have failed her nation, adopts Juche Idea of Great… https://t.co/OiUI9CIBs2"
922900510239313920,2017-10-24 19:00:02,US senator begs pardon for support of Japanese warlords and crimes against humanity to Korean people. https://t.co/6k33KN0o1B
922894016886312961,2017-10-24 18:34:14,"Ayatollah Roy Moore endorsed by US senators Rand Paul, Mike Lee, Ted Cruise, proving US ""libertarian republican"" mo… https://t.co/o9z7GdTyp3"
922886302395129856,2017-10-24 18:03:35,"Ministry of Justice administers 315,607 subpoenas to US computer company Twitter for terrorist accounts linked to ""@KimJonGUnIsALardass."""
922858568424058881,2017-10-24 16:13:23,Unorthodox spelling earns former head of English translation at @DPRK_News promotion to Carbon Monoxide Safety Inspector at Bureau of Mines.
922853525159157760,2017-10-24 15:53:20,Italian diplomat expelled from Pyongyang hotel after attempt to make wine in bathtub created foul ichor resulting in outbreak of diarrhea.
922830397960048640,2017-10-24 14:21:26,"Marshal Kim Jong-Un said to have adopted ""wait and see"" attitude toward necessity for immediate destruction of Unit… https://t.co/Y5jbcxqzQu"
922825288483995650,2017-10-24 14:01:08,"Surprise visit by Supreme Leader Kim Jong-Un to Italian embassy Halloween party nets prizes for ""most creative"" and… https://t.co/zNS8bBEYEk"
922800210568515586,2017-10-24 12:21:29,Craze for curved and even circular televisions in west said to be inspired by widespread adoption in DPRK.
922752791470252032,2017-10-24 09:13:04,"Democratic Peoples Republic of Korea on course to surpass China, United States, through production of block-chain machines."
922668088977448960,2017-10-24 03:36:29,"""Sexy Commander In Chief"" costume worn by Donald Trump for US Halloween ritual falls flat. https://t.co/G3wC4ZLRBa"
922629904428093441,2017-10-24 01:04:45,"Western parents warned: Child ""Halloween"" costumes depicting Marshal Kim Jong-Un constitute cultural appropriation against Korean heritage."
922557872613085186,2017-10-23 20:18:31,"Return of ""Dinosaur Truck,"" beloved fable of Dinosaur which is also Truck, to KCNA gladdens hearts of Korean children."
922550702794248193,2017-10-23 19:50:02,"By order of Supreme Leader Kim Jong Un, Pyongyang Zoo begins preparations to breed World's Most Beautiful Hippopotamus."
922548525099085824,2017-10-23 19:41:23,"Bill OReilly joins dissident filmmakers Harvey Weinstein and Roman Polanski, and jazz singer Bing Crosby, as leadin… https://t.co/ghdgAUhrYU"
922545975515910146,2017-10-23 19:31:15,Interview from political prison by US dissident and prisoner of conscience Bill OReilly moves millions worldwide to… https://t.co/TbZks2nM9q
922516716365799424,2017-10-23 17:34:59,"""Voldemort"" is universal symbol of Evil used by inarticulate western reporters to describe policies they lack educa… https://t.co/3MuKssWkzB"
922511711667736576,2017-10-23 17:15:06,"Once proud Fat Man Chris Christie grovels in the fashion of a cringing slave, kissing the boots of his wrathful Mas… https://t.co/Z1ahpyeHNn"
922502485947895808,2017-10-23 16:38:26,"Failed US congressman W Joseph Walsh, still stung by election loss to disabled woman soldier, resorts to attacking… https://t.co/riAsD6Pd40"
922465859242741760,2017-10-23 14:12:54,Embrace Juche Idea of Great Leader Kim Il-Sung; take up arms in revolutionary struggle; collectivize all lands; and… https://t.co/SsWprF14Ej
922463693434228737,2017-10-23 14:04:17,"""Punisher"" is upcoming US television documentary concerning brutal treatment of Italian and Irish immigrants by US… https://t.co/SyEoJR1aJw"
922442045331005440,2017-10-23 12:38:16,"In call to widow of soldier Myeong Worcestershire-Otorhinolaryngologist, Marshal Kim Jong-Un pronounces name easily and without hesitation."
922416770337705985,2017-10-23 10:57:50,"Marshal Kim Jong-Un, Victor Of 1,000 Battles, allows neither ""Bone Spurs"" nor crippling war wounds to deter him fro… https://t.co/i02XIgIy5E"
922413982526427136,2017-10-23 10:46:45,"US senator from Vietnam John McCain rightly calls Donald Trump squawking vicious poltroon, boasting of prowess whil… https://t.co/DrEGyyubpa"
922145240324198400,2017-10-22 16:58:52,Offer by beloved US president Jimmy Carter to visit Pyongyang proves world's high regard and esteem for Marshal Kim… https://t.co/yCM6CDLU3t
922143312840216576,2017-10-22 16:51:13,"United States television is described as ""vast wasteland,"" endlessly screaming, cajoling, and offending.

https://t.co/aNyoMJ1NLr"
922111406115311618,2017-10-22 14:44:25,Marshal Kim Jong-Un routinely questions the actions of four-star generals. https://t.co/CQ2eGc4jyy
922038452706791424,2017-10-22 09:54:32,Marshal Kim Jong-Un sends congratulatory telegram to Zimbabwe human rights champion Robert Mugabe for appointment a… https://t.co/Sz75xkYu9s
922033317058408448,2017-10-22 09:34:07,Opening of Kim Il-Sung University to foreign students of law brings rush of high-power attorneys seeking lucrative career in DPRK trade law.
921923208005259264,2017-10-22 02:16:35,United States to release all records on John F. Kennedy assassination save those which would prove guilt of CIA. https://t.co/yArub4MVb8
921892151847464960,2017-10-22 00:13:11,"US conservatives split between anti-anti-Trump and anti-anti-anti-Trump gangs

Marshal Kim Jong-Un is not US conser… https://t.co/1SUuXTZLtk"
921850012082065411,2017-10-21 21:25:44,"""Surprise sex"" enthusiast and condom-vandal Julian Assange reveals secrets of masculinity, to adoring women from hi… https://t.co/EnyRgYXumW"
921814496481611776,2017-10-21 19:04:37,"30 billion Won fine against US television shouting man Bill OReilly for rape astonishes world.

Marshal Kim Jong-Un… https://t.co/E3wpj9bCUI"
921793923705577473,2017-10-21 17:42:52,Thousands astounded as Supreme Leader Kim Jong Un laps all street racers in personally modified 1980 Honda Civic Hatchback.
921777760821014530,2017-10-21 16:38:38,"Russian president Vladimir Putin places fourth in Vladivostok regional spelling bee, completing six words before mi… https://t.co/xwElKQrlsI"
921730413713911808,2017-10-21 13:30:30,"United States ""National Public Radio"" propagandist Scott Simon derided as thrice-accursed oaf, braying his own praises to audience of one."
921653710211747840,2017-10-21 08:25:42,DEVELOPING: Marshal Kim Jong-Un on track to score unheard-of quintuple quadruple in basketball exhibition against Peoples Republic of China.
921590946298580992,2017-10-21 04:16:18,"Supreme Leader Kim Jong-Un diligently waits his turn for fitting of latest Jordan Elite tennis shoes, as one citize… https://t.co/0tE3kGrGLC"
921570082085580800,2017-10-21 02:53:24,"When the night has come...
and the land is dark... 
and the Moon is the only light we'll see... https://t.co/kQSiDgPaGY"
921563874746396672,2017-10-21 02:28:44,"Nine years later, once vibrant promise of ""Obama-Phone"" is revealed as empty and meaningless sham perpetrated upon… https://t.co/WKebI4FgLq"
921478462552072193,2017-10-20 20:49:20,Marshal Kim Jong-Un harpoons and reels in 6 blue whales and 4 finbacks to win 2017 All-Korea whaling competition.
921461724309417984,2017-10-20 19:42:49,US Libertarian Death Cult proud of greasy she-ogre Donald Trump in same way an idiot mother is proud of her idiot b… https://t.co/yRR06asos2
921453171653926914,2017-10-20 19:08:50,"Passion for ""Romphims"" among western youth continues with no end in sight.

DPRK youth study physics and marksmansh… https://t.co/QeMYrfPi7u"
921435067892862977,2017-10-20 17:56:54,"Finally, it is widely agreed that MiGs of Korean Peoples Air Force would humble even Manfred Von Richthofen, famed ""Red Baron"" of Germany."
921432835612954624,2017-10-20 17:48:02,"Wooden fleets of English admiral Nelson would be easily destroyed by Korean Peoples Navy submarines and torpedo boats, historians also say."
921431754996682753,2017-10-20 17:43:44,"Korean Peoples Army rocket artillery and massed rifle infantry would annihilate Mongol hordes of Genghis Khan, historians agree."
921431143072894977,2017-10-20 17:41:18,"Marshal Kim Jong-Un is greatest military leader of all times, eclipsing Napoleon, Sun Tzu, and Genghis Khan, respected historians say."
921414998785748992,2017-10-20 16:37:09,Compulsory interviews of serial murderers by preening English fop Piers Morgan described as brutal and inhumane pun… https://t.co/JDh9NmiSC9
921412207929450499,2017-10-20 16:26:04,"Exiled Donald Trump court fool Anthony Scaramucci announces new career as interlocutor of ""interesting questions"" c… https://t.co/L87n5jumHU"
921407938987773952,2017-10-20 16:09:06,"Beloved US television generalissimo David Clarke said to be on his deathbed, due to toxic concentration of metals i… https://t.co/tVkc1sapED"
921402873753325568,2017-10-20 15:48:58,"""Taiwan Jones"" is most popular name for western children born in 2017, according to US demographic database Twitter."
921398032083701760,2017-10-20 15:29:44,"""Death of Stalin"" is tragic documentary on post-1953 decline of Russia into nation of liberals clad in ""yoga pants""

https://t.co/t3X0vBtS4r"
921370973206695936,2017-10-20 13:42:12,"Popular militias in Malawi forced to destroy vampires, due to government inaction.

Marshal Kim Jong-Un personally… https://t.co/3KQks2jMQT"
921365223860252672,2017-10-20 13:19:22,United States comedy television network Fox News is criticized for inappropriate stereotyping of characters. https://t.co/vT1wv0P13e
921291502634131457,2017-10-20 08:26:25,"English universities face ruinous fines for suppressing student speech.

Kim Il-Sung University is world's best rat… https://t.co/GUMFP05EJb"
921166948599255041,2017-10-20 00:11:29,"US senator Bernard Sanders is ejected from Womens Convention, due to lack of rugged and manly self-assurance that w… https://t.co/mBg1aGMTJr"
921134619004719106,2017-10-19 22:03:01,"Fifty years later, craze among western degenerates for music of Herb Alpert and Tijuana Brass shows no sign of stop… https://t.co/zSEmh4yELm"
921122387155914752,2017-10-19 21:14:25,"""Florida Man"" is United States term for vicious imbecile, who leaves injury in his wake and brings shame upon all w… https://t.co/JXtqpfQMBU"
921116191862685696,2017-10-19 20:49:48,"US supreme court judge Don Willett said to be in hiding, due to his shame and disgrace concerning vile slanders against Marshal Kim Jong-Un."
920999566509510657,2017-10-19 13:06:22,Supreme Leader Kim Jong-Un said to possess world's largest stockpile of MacDonalds Szechuan sauce.
920865672829181952,2017-10-19 04:14:19,"Travel advisory issued for DPRK tourists visiting Ireland, for foodstuffs likely to cause severe gastrointestinal d… https://t.co/nQGzSMhmrA"
920774783188586496,2017-10-18 22:13:10,"Craven NY Times bars ""Twitter"" reporters from criticizing Donald Trump.

@DPRK_News journalists enjoy total freedom… https://t.co/koJ1hFJKy7"
920759251072626688,2017-10-18 21:11:26,"US first lady Ivanna Trump achieves the Tao, state of perfect nothingness foretold by ancients and scribes, through… https://t.co/BqgfDmmunn"
920742074101784581,2017-10-18 20:03:11,"Marshal Kim Jong-Un consoles grieving military widow with powerful speech, listens patiently to her concerns, and p… https://t.co/1afMs3WTUU"
920664828120793088,2017-10-18 14:56:14,"Proposed French law prohibiting obscene behavior toward women in public would result in jailing of 90% of French men, study finds."
920660185932328961,2017-10-18 14:37:48,"Drunken rant by defeated US oligarch Hillary Clinton ends in ""selfie"" featuring English flag and nonsensical gibber… https://t.co/jh0r45aThF"
920655919951867904,2017-10-18 14:20:50,"Ostrich runs loose on freeway in south Korean puppet capital of Seoul, maiming citizens at will. Decline of ""west""… https://t.co/YB4d8iJnZY"
920653484084604934,2017-10-18 14:11:10,"Cow runs roughshod through US cultural capital Brooklyn; citizens flee in mass panic.

Pyongyang strictly regulates… https://t.co/v3ZQs1YsTv"
920410387295686656,2017-10-17 22:05:11,"Supreme Leader Kim Jong-Un modestly denies pivotal role in capture of ""Islamic State"" capital Raqqa, despite all evidence to the contrary."
920178376878542848,2017-10-17 06:43:15,Ministry of Culture bans Elf cosplay.
920176171568041985,2017-10-17 06:34:30,Attempted defection of Yale university professors at South Korean puppet state border is rejected due to insufficient academic prestige.
920170966440906752,2017-10-17 06:13:49,"Kim Il-Sung University named world's greatest, exceeding Oxford and Princetown, according to prestigious World Econ… https://t.co/4iuXr829UP"
919943379689058304,2017-10-16 15:09:28,"Latest scientific findings confirm theory of Supreme Leader Kim Jong-Un, and Albert Einstein, that gravity is wave. https://t.co/rdPHvCGVv6"
919936956435275776,2017-10-16 14:43:56,"Supreme Leader Kim Jong Un receives protrait from 8 year old Pi Ju-Ah of Haeju, in commentating on of brave rescue… https://t.co/VijTs7cpUS"
919933135760093184,2017-10-16 14:28:45,"Ministry of Tourism weighs anti-Donald Trump credentials of ""Macklemore"" against fact he is screeching unlistenable… https://t.co/dOrzGvSrBU"
919923646335979520,2017-10-16 13:51:03,"Alleged Wikileaks ""bombshell"" concerning Harvey Weinstein reveals little that is not already known, according to Mi… https://t.co/8frr85nbpc"
919920479133224961,2017-10-16 13:38:28,"U.S president Donald Trump has fallen, and he cannot get up. https://t.co/yl3ANKh7wf"
919384638728097792,2017-10-15 02:09:13,"""Twitter"" is US computer service that frequently and forcefully reminds users that internet was always more enjoyab… https://t.co/LrGN9NE677"
919380619439886336,2017-10-15 01:53:15,US computer magnate Mark Zuckerberg demands that you kneel before him. https://t.co/Mg2yRvxWsL
919365316991471616,2017-10-15 00:52:27,"Possession of ""Sloth,"" vicious African monkey known for devouring children, is now deemed crime of the first degree… https://t.co/jTcDhkKf9P"
919349005930385408,2017-10-14 23:47:38,"""Neck Beard"" is caste symbol for engineer class in west, designating high status technological males enjoying super… https://t.co/QGvJE7EkFF"
919327981662867456,2017-10-14 22:24:05,"He'd love to wear a rainbow every day, and tell the world that everything's OK,

'Till things are brighter, He's th… https://t.co/PR0d7YVhlY"
919324859431256064,2017-10-14 22:11:41,Ascension of Mount Everest poses little challenge to Supreme Leader Kim Jong-Un. https://t.co/pW45R5Cyyh
919195172164001799,2017-10-14 13:36:21,Lord of Rings is western tale of dim-witted midget ordered to scale volcano for amusement of his feudal masters.
919009667384336384,2017-10-14 01:19:13,Democratic Peoples Republic of Korea opens 20 honorary consular offices in Bulgaria. https://t.co/5cQiOT7VW0
919007870921986048,2017-10-14 01:12:05,"US ""national public radio"" announcer Kai Rysdall denounced as insipid promoter of globalist claptrap."
918959062305341441,2017-10-13 21:58:08,Supreme Leader Kim Jong-Un is named Best Dressed Man in Democratic Peoples Republic of Korea for fifteenth consecut… https://t.co/lSx9ATIzGC
918952255935647745,2017-10-13 21:31:05,"Spider web is metaphor for barren Harry Potter fiction, which devours young children of the west only to excrete co… https://t.co/Zu1TRVABt3"
918929763565232129,2017-10-13 20:01:43,"""Halloween"" is class-based US holiday on which rich children receive candy, whilst poor receive methamphetamine and… https://t.co/wl5fMue1Ll"
918919479115075584,2017-10-13 19:20:51,"""Famed US Actor Steven Steagal Hair Club For Men"" is granted exclusive patent for glue-on plastic hair prostheses i… https://t.co/ilb89k8jr2"
918901411177553925,2017-10-13 18:09:03,"Foreign Ministry revokes visa of Virgin Islands president, on grounds that Virgin Islands is not a nation and has no president."
918891748381863936,2017-10-13 17:30:39,"All Korea Basketball Association rescinds University of North Carolina invitation to play exhibition in Pyongyang,… https://t.co/k1SxRDGQop"
918890434990170112,2017-10-13 17:25:26,Hurricane poised to strike Ireland and England is ascribed to incompetent climate management by English prime minister Theresa May.
918887126380503041,2017-10-13 17:12:17,Foreign Ministry certifies Qatar as meeting all human rights requirements for participation of DPRK football in 2022 World Cup.
918863115365707776,2017-10-13 15:36:53,Failure by US celebrity astrologer to provide foolish Twitter analogy concerning Harvey Weinstein scandal sparks ru… https://t.co/RQpsUClkCD
918851743664017408,2017-10-13 14:51:41,"Production of software and computer code exceeds Ministry of Technology quota by &lt;new String(""test"").equals(""test"") // --&gt; true&gt;"
918846793013743623,2017-10-13 14:32:01,"Truthful content of all @DPRK_News stories assured by rigorous licensing of journalists, under strict oversight by Ministry of Information."
918840489662730240,2017-10-13 14:06:58,Mass boycott of US computer company Twitter by women leaves western men bereft of oppression studies and critical g… https://t.co/XJjQJDZPZH
918837672956841984,2017-10-13 13:55:47,"""Tyler Perry's Madea Declares War On Class Enemies And Foreign Saboteurs"" is runaway hit at Korean cinema box office."
918539678235676673,2017-10-12 18:11:39,"US ""gossip blogger"" Jessy Kelly is condemned as internet onanist, recklessly spraying his seed to the mortification… https://t.co/OnmWIRgNhl"
918525658480959488,2017-10-12 17:15:57,"Marshal Kim Jong-Un returns unviewed DVD of ""English Patient"" to Harvey Weinstein, citing fact that ""English Patien… https://t.co/OjT8LyDM8k"
918520719033749504,2017-10-12 16:56:19,"Unidentified clown becomes unlikely hero for attempting to wrest pen from hand of Donald Trump, lest he bring furth… https://t.co/yt9W935qKf"
918506150768922630,2017-10-12 15:58:26,Empty threats by US tabloid journalist Jessy Kelly are dismissed as moral flatulence from an impotent straw-head. https://t.co/OXv2YwHuuN
918502967019540481,2017-10-12 15:45:46,"""Selfie stick"" is western technology permitting imbeciles to create fantasy world in which their derangements are n… https://t.co/aOU3ZXl2TO"
918495418891284480,2017-10-12 15:15:47,"US computer company Twitter proves ""freedom of speech"" to be empty myth, terminating actress Rosette MacGowan for d… https://t.co/M62cHEj7RK"
918289215791644672,2017-10-12 01:36:24,Mangy She-ogre Donald Trump puts unknown old idiot to sleep during 5 hour lecture regarding best practices for grab… https://t.co/Rv1LkY2820
918187330053144576,2017-10-11 18:51:33,"Marshal Kim Jong-Un declines ""MacArthur Genius"" award, citing despicable war crimes of MacArthur."
918100413303476224,2017-10-11 13:06:10,"""National Coming Out Day"" is sole US holiday devoted to outdoor activity &amp; sport.

DPRK people enjoy coming out alm… https://t.co/TKy2HqT84S"
918097820820717568,2017-10-11 12:55:52,"As US enters critical state, Ineffectual Fop Lindsay Graham curries favor with Unstable Baboon Trump, not knowing h… https://t.co/dxIsxR43Vx"
918002000071135232,2017-10-11 06:35:07,Scrappy underdog Germany seen as team most likely to finish second to DPRK in 2018 world cup.
917960179668455424,2017-10-11 03:48:56,"US Football Federation plan to do do nothing after loss.

Such failures in DPRK punished by being kicked in the face by Donkey of Shame."
917955410891390976,2017-10-11 03:29:59,"UNITED STATES ELIMINATED FROM WORLD CUP CONTENTION BY TOBOGGAN TEAM. 

DPRK UNDEFEATED IN WORLD CUP COMPETITIONS."
917819423033053184,2017-10-10 18:29:37,"""Prairie dog"" is North American vermin which lives on prairie, but is not dog. https://t.co/RIzNMw4o3K"
917758680556113920,2017-10-10 14:28:15,We take America from the corrupt! The rich! The oppressors of generations who have kept you down with myths of oppo… https://t.co/cj58m9WzwA
917752018734927877,2017-10-10 14:01:46,"Supreme Leader Kim Jong-Un painfully breaks with dear friend Harvey Weinstein, citing inappropriate sexuality. https://t.co/NszhLobrln"
917741206775484416,2017-10-10 13:18:49,Catalones and similar peoples cheer as Marshal Kim Jong-Un determines to support Catalone freedom from Spanish conq… https://t.co/R3qFacajgQ
917533880738922498,2017-10-09 23:34:58,Dead-eyed national socialist polymath Stephen Miller rumored to passionately seek out White Supremacy and yet deriv… https://t.co/iMEJBVyFYE
917528537304850433,2017-10-09 23:13:44,Impact of Equifax computer security breach on Democratic Peoples Republic of Korea is said to be slight.
917523854620323840,2017-10-09 22:55:08,"Perverse habit of western actresses, in placing tattoos depicting Marshal Kim Jong-Un on buttocks, continues. https://t.co/Uz6f2f1oZ1"
917413060188491779,2017-10-09 15:34:52,"@DPRK_News now has capacity for 1020 character ""tweets.""

General Kim Jong-Un already has composed 1021 character ""tweet"" on private account"
917408525252472832,2017-10-09 15:16:51,"Marshal Kim Jong-Un scores unheard-of double fatality as ""Sub-Zero"" against ""Leather Face"" in Mortal Kombat match a… https://t.co/b8e7GLjF7w"
917399258977964038,2017-10-09 14:40:02,"""Disgraced Donald Trump Adviser Sebastian Gorka Struggles To Enjoy Normal Bowel Moment"" is surprise ""reality tv"" hi… https://t.co/OadacUYnRQ"
917374636475715584,2017-10-09 13:02:11,"""Columbus Day"" is United States holiday honoring Italian Americans and their never-ending sense of outrage, aggriev… https://t.co/F5dtXWj7uC"
917212500067790848,2017-10-09 02:17:55,"Esteemed Kim Jo-Yong, sister of Marshal Kim Jong-Un, is promoted to Workers Party Politburo in light of her outstan… https://t.co/JothLPlcXf"
917075705120350209,2017-10-08 17:14:21,Renegade Ostrich attacking children at Pyongyang Zoo meets its match in Supreme Leader Kim Jong-Un.
917023392842252289,2017-10-08 13:46:28,"United States continues to lag remainder of world in treatment of homeless, drug addicts, and lunatics. https://t.co/UiscJA2cKA"
916344003917905920,2017-10-06 16:46:50,"Donald Trump foreign minister Rex Tillerson rumored to be stepping down, to spend more time with his oil barrels an… https://t.co/GdqAKjxeIX"
916322788415287297,2017-10-06 15:22:31,"Latest threats by sexual companion to swine Donald Trump are dismissed, as the calm before a storm of demented bell… https://t.co/QrncYKOJ5t"
916291961371484160,2017-10-06 13:20:02,Foreign Ministry congratulates ICAN on Nobel peace prize for its successful labours to abolish nuclear weapons.
916025330024026112,2017-10-05 19:40:32,"Prestigious Harvey Weinstein Film Co. to open Pyongyang film studios, citing favorable labor conditions and progres… https://t.co/agifISabQO"
915997243978772480,2017-10-05 17:48:56,Red Banner Antivirus Software announces contract to provide data security to United States National Security Agency.
915983004392071168,2017-10-05 16:52:21,"""Mealworm burgers"" and similar treats now sold in Switzerland, as collapse of banking economy reduces Swiss peoples… https://t.co/zUaqawtc99"
915972246388305920,2017-10-05 16:09:36,"Tragedy strikes New York City, as 27 children standing between US celebrity eating contestant Michael Moore and a m… https://t.co/KYyVzbKEoy"
915968728453525505,2017-10-05 15:55:37,"Turkish president Recep Tayyip Erdogan seeks lasting relationship with ""soul mate.""

His interests include travel,… https://t.co/RXDI9q10PX"
915953188431368192,2017-10-05 14:53:52,"Nobel in literature goes to Japanese author Kazuo Ishiguro, for philosophical breakthroughs in traditional genre of tentacle pornography."
