id,created_at,text
812093179717525504,2016-12-23 00:31:16,"Millions gather at Pyongyang zoo for annual Gorilla Festival, in which weaker members of local troop are dealt with."
812055807365939201,2016-12-22 22:02:46,"US December 25 Holiday sees bearded ogre giving gifts to rich children; Poor receive nothing!

Marshal Kim Jong-Un is gift to all children."
812006786458914816,2016-12-22 18:47:58,"Terror wave aboard US aircraft sees innocent Muslims and Ivan K Trump victimized.

Air Koryo is rated world's safest airline by top experts."
811972919006003200,2016-12-22 16:33:24,"Year 2016 is remembered as ""Great Year Of Wonder and Glory,"" for successful nuclear test, missile launches, and similarly marvelous events."
811966579126792198,2016-12-22 16:08:12,"Millions in west claim ""true communism has never been attempted."" Democratic Peoples Republic of Korea proudly prov… https://t.co/DTd5LHg5t6"
811828183079100416,2016-12-22 06:58:16,"""Beast of Haeju"", legendary creature known for stealing women's undergarments, found to be deranged Italian tourist."
811824467420688384,2016-12-22 06:43:30,"Supreme Leader Kim Jong Un receives gift of gold-plated, jewel-encrusted eagle from delegation of Foreign Women."
811727720530878464,2016-12-22 00:19:04,Stadium crowd at Rungrado 1st of May Stadium sets noise record of 186.5 decibels during Woman's U-21 football match against Philippines.
811624620226936832,2016-12-21 17:29:23,"New film promoting telephone ""emojis"" as lovable role models celebrates decline of literacy and imbecilic degradation of western society."
811615331886202880,2016-12-21 16:52:28,Air Koryo flight crew receives highest commendations for ejecting suspicious individual caught speaking English from flight to Moscow.
811579036489154560,2016-12-21 14:28:15,"""Divorce parties"" become new trend in U.S. California province, as frivolous libertines celebrate destruction of th… https://t.co/kFKg7HUREe"
811576168180809728,2016-12-21 14:16:51,"Blanket of smog in Peoples Republic of China blights the lands and destroys the people.

Such is the price of embra… https://t.co/hs2mHfmc5b"
811574267565502464,2016-12-21 14:09:18,"US computer company Twitter loses half value, as technology sector crashes.

Red Banner Cigarettes of DPRK pursues lucrative trade ventures."
811320109247688704,2016-12-20 21:19:22,"Joint agreement of Russia, Turkey, DPRK, and Iran expected to bring peace among bickering peoples of war-torn Syria."
811318104936640512,2016-12-20 21:11:24,"""Friend"" is DPRK ""social media"" service.

All web internet world-wide reactions on ""Friend"" are socially harmonious, and friendly."
811315019006824448,2016-12-20 20:59:08,"Noted ""internet web comic"" concedes that Juche Idea of Great Leader Kim Il-Sung is superior to any western so-calle… https://t.co/dd5zwL1F5e"
811229994315907072,2016-12-20 15:21:17,"United States militant revolutionary Bernard Sanders escapes from exile, vows to punish class enemies in apocalyptic blood purge of fire."
811117115923017728,2016-12-20 07:52:44,"Waiting list for ""Shopping with Security Apparatus Personnel"" program in Pyongyang reaches 20000 willing participants!"
811114885614485504,2016-12-20 07:43:53,"Italian Naturopath arrested after massive catastrophic diarrhea outbreak in Nampo found to be linked to ""holistic Medicine""."
811112034796445696,2016-12-20 07:32:33,"U.S. senator from Texas Ron Paul is early democratic favorite to challenge Donald Trump, after strong 3rd place finish in electoral college."
811106384653799424,2016-12-20 07:10:06,"US president Obama tearfully concedes Russia is, in fact, major geo-political threat to United States.

#1 threat t… https://t.co/4BE01gx413"
811103085393313792,2016-12-20 06:56:59,"German officials to fine US computer company ""Face Book"" 6 million Won for ""fake news.""

DPRK increases fine to 60 million Won."
811099996397469696,2016-12-20 06:44:43,"Solicitude by US republicans for Wikileaks leader Julian Assange is not extended to Edward Snowden or Chelsea Manning, for some reason."
811093506647293952,2016-12-20 06:18:56,"Marshal Kim Jong-Un scores yet another victory against south Korean aggressors, with invincible ""Five Torbjorns, One Mercy"" defense."
811030838087393284,2016-12-20 02:09:54,"Leather, used in most of world as shoe cladding, is material for ladies pants in Texas province, and is cooked as delicacy called ""barbecue"""
811030352147910656,2016-12-20 02:07:58,"@DPRK_News to visit U.S. province of ""Texas"" for next seven days. Readers urged to enlightenment by ""Facts Concerning Texas Province."""
810988732258000896,2016-12-19 23:22:35,"Weaklings of Arsenal Football Club cancel friendly exhibition against DPRK mens football, to chagrin of Arsene Wenger apologist @piersmorgan"
810982228645777411,2016-12-19 22:56:45,"Servile US senator from Canada Ted Cruise remains chained to desk in Trump campaign headquarters, unaware election… https://t.co/NoDxcX8AU7"
810968259239563264,2016-12-19 22:01:14,"Thirty-seven Pyongyang christians arrested on suspicion of plotting terror attack, anti-state activities, and distributing bibles."
810964139719950336,2016-12-19 21:44:52,"Hillary Clinton excuses for loss now include FBI, Russian hacking, traitor electors.

Marshal Kim Jong-Un wins office through manly charisma"
810954937014292480,2016-12-19 21:08:18,"Despicable and ""false"" biography of Dear Leader Kim Jong-Il is condemned as wickedness peddled by a perverted ass. https://t.co/DbKgF5ZTZs"
810953595818561547,2016-12-19 21:02:58,US votes for ex-slave Colin Powell and red indian warrior Faith Spotted Eagle seen as support for Juche Idea of Great Leader Kim Il-Sung.
810905338803290112,2016-12-19 17:51:13,"Security at Russian embassy increased following religious attack in Turkey. DPRK christians, muslims, and buddhists placed on surveillance."
810860570140438529,2016-12-19 14:53:19,"IMF leader Christine Lagarde condemned for shocking payment of 500 billion Won to plutocrat.

DPRK accepts no tainted moneys from IMF."
810859356598267904,2016-12-19 14:48:30,"Democratic Republic of Congo president Joseph Kabila urged to stay in office beyond term, in heartwarming display of love from his people."
810695622504419328,2016-12-19 03:57:53,"Tens of thousands of ISIS terrorists said to have been killed in victorious liberation of Aleppo, Syria."
810694369787441152,2016-12-19 03:52:54,"United States rated least democratic nation on Earth by political scientists, as Chief Warlord is elected by oligarchy of only 538 people."
810688512299245568,2016-12-19 03:29:37,"Exploding ""electronic cigarettes"" kill dozens each day in west. Red Banner Cigarettes of DPRK have mellow flavor and healthful properties."
810393093086310400,2016-12-18 07:55:44,"""Fountainhead,"" by Ayn Rand, is tale of greedful capitalist architect who destroys housing of poor people out of misplaced pride."
810324180562493443,2016-12-18 03:21:54,"US gangster president claims Donald Trump is Puppet.

Donald Trump denies he is Puppet. Claims Obama is Puppet.

Tr… https://t.co/9KP9OzutGl"
810320416162115584,2016-12-18 03:06:56,"Vladimir Putin now enjoys higher approval from US Republicans than war criminal Ronald Reagan, according to scientific polling."
810280390208405504,2016-12-18 00:27:53,"""Resolution Concerning The Problem Of Coal Production In North Hwanghae Province,"" by Supreme Leader Kim Jong-Un, is named top book of 2016."
810268956946743297,2016-12-17 23:42:28,"""Unpresidented"" mispelling subjects Donald Trump to world-wide derision as hypocritical fool and genuine ass."
810265026418380802,2016-12-17 23:26:50,Passage of Dear Leader Kim Jong-Il is remembered as greatest tragedy to strike mankind in 21st century.
810263801782272000,2016-12-17 23:21:58,"Ministry of Production bans ""laundry scent boosters"" and ""energy drinks,"" as utterly useless products."
810221204435046400,2016-12-17 20:32:42,"Heinrich Heimlich, infamous creator of the fascist ""Heimlich manuever"" torture technique, dies before he can be tried for his crimes."
810163821293826053,2016-12-17 16:44:41,"Pyongyang Arch of Triumph, 10 meters taller than Paris Arc de Triomphe, symbolizes greatness of Korean peoples, wor… https://t.co/FbEoWyrXzh"
810162051322675200,2016-12-17 16:37:39,Infrastructure and public works investment brings promise of unprecedented economic growth to DPRK workers and peas… https://t.co/ScmZKc594N
809968895515852800,2016-12-17 03:50:07,"United States ""whistle suckers"" urged to contact @DPRK_News with braking leeks! All confidentialities must be prote… https://t.co/psK4rcONMr"
809951291288023040,2016-12-17 02:40:10,Republican Workers Party in United States province of North Carolina embraces Juche Idea of Great Leader Kim Il-Sung!
809947929322618882,2016-12-17 02:26:49,"Donald Trump poised to add yet another southern military fascist rebel to cabinet, with Colonel Harland Sanders lik… https://t.co/xk9x3W0qNn"
809946787519795200,2016-12-17 02:22:16,Pledge of inter-Korean dialogue from south Korean presidential candidate Moon Jae-In seen as rejection of fruitless US puppet alliance.
809937520012226560,2016-12-17 01:45:27,"Governor of US California province vows to launch satellites, in violation of DPRK space sovereignty. Peoples Air Force placed on high alert"
809829066945732608,2016-12-16 18:34:30,"U.S. reporter Kurt Eichenwald is rendered mental cripple by weaponized ""tweet."" DPRK curbs access to internets, for protection of defectives"
809664428975202304,2016-12-16 07:40:17,"Brazen ass @victor_zheng of Canada is denounced as utter moron, for programming of grammatically challenged Twitter… https://t.co/dwKc53Hg9I"
809663787875831808,2016-12-16 07:37:44,Possessors of confidential news strongly urged to contact @DPRK_News on matters of newsworthy. Legitimate privacies… https://t.co/5BA8mgMI9n
809660799438516224,2016-12-16 07:25:52,Little peoples of Belgium tremble and quail before the imperious might of Korean Peoples Navy.
809463988912156672,2016-12-15 18:23:48,"Calls for prohibition of ""fake news"" in west show wisdom of Marshal Kim Jong-Un. DPRK citizens enjoy total protection from false journalism."
809390840497979392,2016-12-15 13:33:08,"Independent news monitoring agency finds @DPRK_News most independent and freedom-loving news agency, due to indepen… https://t.co/Z1We7vFZnO"
809385122504081408,2016-12-15 13:10:25,"US newspaper Politico fires writer for speculating on incest by Donald Trump.

All DPRK reporters are free to discuss incest by Donald Trump"
809382957471432705,2016-12-15 13:01:49,"President Kim Yong-Nam announces he will not view ""Rouge One,"" citing dismay at prequels and mistrust of Disney to… https://t.co/Mnb2TdK0Q8"
809136043886804992,2016-12-14 20:40:40,"Wine-soaked sybarite Hillary Clinton to hold drunken ""thank you"" party for donors with last campaign funds, rather than donate to the poor."
809077302743171073,2016-12-14 16:47:15,Male enhancement sector of DPRK pharmaceutical industry swells to gigantic proportions.
809061248524550144,2016-12-14 15:43:27,"Corpulent American blimp Lena Dunham is given final warning: cease meddling in East Asia affairs, or face the fist… https://t.co/H9MRCt6xAv"
809052315747368960,2016-12-14 15:07:58,"In his lair atop Manhattan, Donald Trump bides his time, waiting to name agriculture minister at time calculated to spur maximum outrage."
809050983246467072,2016-12-14 15:02:40,"KPA Major Case Squad, led by Agent ""Steel Axe,"" arrests 17 traitors and malefactors for spreading western ""Gamergate"" conspiracy hogwash."
809020486453776384,2016-12-14 13:01:29,"Reports Donald Trump security adviser Michael Flynn shared intelligence expected to draw angry ""Lock him up!"" response from Trump supporters"
808801623300599808,2016-12-13 22:31:48,"Repugnant Turk Recep Erdogan is named world's leading jailor of journalists.

Marshal Kim Jong-Un is benevolent father of free DPRK press."
808764532415926272,2016-12-13 20:04:25,Inhabitants of US California province use totemistic markers affixed to automobiles for purpose of mating and signi… https://t.co/NUXjz1difv
808742371127160833,2016-12-13 18:36:21,Philosophical breakthrough takes Kim Il-Sung University biologists one step closer to discovering hidden purpose of Marmite.
808734746129874944,2016-12-13 18:06:03,"Gambian leader Yahya Jammeh vows to remain president for life, for protection of Gambian democracy and African habe… https://t.co/vctdviP9NR"
808723915862319104,2016-12-13 17:23:01,"Donald Trump minister of nuclear weapons Richard Perry known as governor of Texas province, famed for its production of tacos and bumpkins."
808722420551077888,2016-12-13 17:17:05,Leaked electronic mails of Marshal Kim Jong-Un show Leader chastising sluggardly officials; agonizing in tender concern for Korean children.
808705674460991488,2016-12-13 16:10:32,US statesman Mitt Romney reportedly still in tears at loss of opportunity to spend four years toadying before vulga… https://t.co/8DWvCTq4d2
808695950264958976,2016-12-13 15:31:54,"Shelving of ""driverless automobile"" by US computer company Google shows utter futility of scientific competition against DPRK."
808689404432752640,2016-12-13 15:05:53,Punishment of traitors in Aleppo shows fatherly dedication of president Assad to improving mental hygiene of Syrian peoples.
808687644045701120,2016-12-13 14:58:53,"Donald Trump to spend day associating with famous wrapper Kayne West, in futile attempt to establish ""cool"" by ""shaking his booty."""
808591402108067840,2016-12-13 08:36:27,"Missing aide to south Korean puppet president Park Geun-Hye, wanted for questioning on corruption, is assumed to be victim of foul sorcery."
808588751937175552,2016-12-13 08:25:55,"Jakarta blasphemy trial calls into question whether primitive Indonesians are worthy to use speech, fire, and other gifts of civilization."
808481961060798470,2016-12-13 01:21:35,Donald Trump denies widespread allegations that he is Puppet; Insists others are Puppets; denies once more that he is Puppet.
808388512403849216,2016-12-12 19:10:15,"As United States falls into Russian bondage and puppetry, deluded American serfs bicker over political meaning of latest ""Space Wars"" film."
808374940940566528,2016-12-12 18:16:19,"Donald Trump considers businesswoman Carlo Fiorina for intelligence chief, in hopes she will duplicate record of success at Hewlett Packard."
808358527366496256,2016-12-12 17:11:06,"US green party now seeks 10 billion Won to depose Donald Trump.

Great Leader Kim Il-Sung defeated imperial Japanese with only 5 billion Won"
808353780228034564,2016-12-12 16:52:14,"Sordid images of leading warmonger John Bolton ""getting his groove on"" amid nubile and voluptuous blondes endangers… https://t.co/Ul4PDnPRe7"
808351514758696961,2016-12-12 16:43:14,"As Donald Trump tightens US immigration and trade, peoples of Latin America and Asia look to Marshal Kim Jong-Un as reliable trading partner"
808350680222142465,2016-12-12 16:39:55,"Supreme Leader Kim Jong-Un announces ""Always Winter, Never Christmas"" campaign to combat superstitious holidays of foreign origin."
808287726135021568,2016-12-12 12:29:45,"Marshal Kim Jong-Un is on right side of history, leading chroniclers agree."
808192926698393601,2016-12-12 06:13:03,"U.S. film artiste Natalie Portman arrives in Pyongyang for cultural talks, and discussion of Juche Idea with Suprem… https://t.co/9wILSxzUoO"
808135117042491392,2016-12-12 02:23:20,DPRK economy said to be most efficient.
808123756916908032,2016-12-12 01:38:12,"Venezuela to remove large bill currency from circulation, as money becomes increasingly obsolete in era of socialist super-abundance."
808121128074022912,2016-12-12 01:27:45,"Tomb of great Cuban leader Fidel Castro is called masterpiece of classical architecture, recognizable for its bold… https://t.co/LrsQ4Q6iSR"
808118471846490112,2016-12-12 01:17:12,"Donald Trump foreign minister Rex Tillerson receives Russian Federation Medal of Friendship, reserved for obedient… https://t.co/vGgw5jVfDk"
807785145940013061,2016-12-11 03:12:41,"Spoiled US debutantes cast aside high heels for red armbands, trade purses for submachine guns, due to outstanding… https://t.co/wQ1tREe2S8"
807782385433645057,2016-12-11 03:01:43,Supreme Leader Kim Jong-Un telegrams congratulations to Russian president Vladimir Putin on defeat of venomous fish-wife Hillary Clinton.
807654708705800192,2016-12-10 18:34:22,"Donald Trump choice of Exxon CEO ""Oildriller McMoneybag"" for foreign minister is seen as move to satisfy economically challenged supporters."
807650976148508672,2016-12-10 18:19:32,"Failure by Nobel committee to award peace prize to Colombian FARC peasant uprising shows bankruptcy of entire ""global peace"" project."
807650414317289472,2016-12-10 18:17:18,"Barbaric video beating ritual at US Reno Nevada province school ends with student shot by police.

DPRK schools tolerate no such hooliganism"
807199859946225665,2016-12-09 12:26:58,"Concern over ""fake news"" by United States press, purveyors of rigged exploding cars and tales of helicopter rescues, is deemed pretty rich."
807197449588789249,2016-12-09 12:17:23,"Impeachment of vile south Korean enchantress Park Geun-Hye is accompanied by baying of wolves, sick children, and curdled milk across Seoul."
806971113427369984,2016-12-08 21:18:00,Malignant sorceress Park Geun-Hye expected to be first south Korean president impeached for witchcraft and necromancy.
806963173857394688,2016-12-08 20:46:27,"US senator from Canada Ted Cruise is now called loneliest man on Earth, shunned and despised by dogs, vagrants, and… https://t.co/e4e7RGTO2k"
806959438259191808,2016-12-08 20:31:37,"Election recount demanded by United States green party now scheduled to take place between 4 and 4:15 pm at ""Rumours Lounge"" in Oakland."
806956653937463296,2016-12-08 20:20:33,"Muslims of Pyongyang foreign embassies asked to join Marshal Kim Jong-Un for bacon and champagne breakfast, in honor of Mohammed's birthday."
806951366291693570,2016-12-08 19:59:32,"Supreme Leader Kim Jong-Un vows to limit feastings upon giraffe steaks to three per week, in light of species' near extinction."
806949246326841344,2016-12-08 19:51:07,"Donald Trump Labour minister ""Carl, Junior"" promises American workers unlimited employment as flippers of disgusting hamburgers."
806885129251618816,2016-12-08 15:36:20,"Democratic Peoples Republic of Korea certified as 100% free of Japanese ""pokemon"" creatures, by leading authorities."
806882614900461568,2016-12-08 15:26:21,"Seismic tremor off US west coast seen as harbinger for future chain of massive earthquakes, spelling certain doom for California province."
806879589137944576,2016-12-08 15:14:19,Japanese warlord Shinzo Abe to apologize for craven attacks on US sailors; No apology expected from Japan to enslaved Korean civilian women.
806876412972072962,2016-12-08 15:01:42,"Donald Trump choice of generals for ""military control over civilians"" cabinet is slavish imitation of Songun Idea of Dear Leader Kim Jong-Il"
806487021938241536,2016-12-07 13:14:24,"Supreme Leader Kim Jong-Un receives prestigious ""Man of the Year"" award from Time Magazine. https://t.co/Uku2tZi4L4"
806332358949564416,2016-12-07 02:59:49,"""White nationalist"" is inexplicable euphemism used by US press to describe Hitlerites and Klansmen.

DPRK press is not so pathetic."
806329685512716290,2016-12-07 02:49:12,Donald Trump press minister Laura Ingraham said to be well qualified for office by virtue of possessing blonde hair.
806328835272830976,2016-12-07 02:45:49,Report showing US ministry for War wastes 125 trillion Won annually is greeted with enthusiasm and joy from Pyongyang to Moscow to Tehran.
806326094995615744,2016-12-07 02:34:56,"Marshal Kim Jong-Un set to destroy 200 south Korean hyundae contraptions at Nampo Fun Fair, piloting monstrous truck ""Hammer of the Workers"""
806324710560636928,2016-12-07 02:29:26,"83% of news stories published by computer company ""Face Book"" shown to be false.

Scientific audit shows @DPRK_News 100% free of ""fake news"""
806214373744246786,2016-12-06 19:11:00,"State Security Agent ""PN34.jpg"" said to have thoroughly compromised all secrets held by Donald Trump foreign minist… https://t.co/DhGDMTosKW"
806211457020993537,2016-12-06 18:59:24,Wild tales concerning child molestation in pizza parlours prove observations by Dear Leader Kim Jong-Il concerning stupidity of Americans.
806207601960775684,2016-12-06 18:44:05,"Piteous Donald Trump whinges United States is too poor to afford air transportation.

Supreme Leader Kim Jong-Un pi… https://t.co/0LLMEO72xb"
805610995456634880,2016-12-05 03:13:23,"New Zealand president John Key resigns as he presided, in disgrace and futility. Let his fate be a warning to all who would oppose the DPRK."
805470184173666305,2016-12-04 17:53:51,"New banknotes from Venezuela commemorate great Cuban caudillo Fidel Castro, and hyperinflation caused by incredible socialist abundance."
805468129480601601,2016-12-04 17:45:41,"Braggartly boasts of US aggressor ""Buzz"" Aldrin dismissed as empty words from mere second man on moon, after DPRK Space Soldier Kum Nam-Gun."
805466166781214721,2016-12-04 17:37:53,Supreme Leader Kim Jong-Un joins Iranian supreme leader Ali Khamenei in warning Donald Trump of unimaginable retaliation for US aggression.
805459464040091649,2016-12-04 17:11:15,Electoral defeat of Austrian fascist Norbert Hofer is compared to defeat of German-Austrian fascist Adolf Hitler by Great Leader Kim Il-Sung
805456037620891648,2016-12-04 16:57:38,"Marshal Kim Jong-Un sends congratulatory telegram, and best wishes for consolidation of Cuban revolution by ""blood purge,"" to Raul Castro."
805454647209193473,2016-12-04 16:52:07,"Burial of Fidel Castro ashes seen as dawn of new era of success for communism in Cuba, as Vladimir Lenin was replaced by Great Joseph Stalin"
805452199727943680,2016-12-04 16:42:23,"Translation at Ministry of Information leads to arrest of 64 socially irredeemable elements and less frequent conjugation of verb ""to be."""
805450832678387714,2016-12-04 16:36:57,"Supreme Leader Kim Jong-Un urges Austrian workers to slaughter Vienna bankers, and peasants to collectivize all arable lands."
805450369845305344,2016-12-04 16:35:07,Victory by leftist anti-Hitlerite candidate in Austrian elections seen is as embracement of Juche Idea of Great Leader Kim Il-Sung.
805245176486699009,2016-12-04 02:59:45,"Effort by US green party to force election recount now confined to three blocks surrounding ""Whole Foods"" in Park Slope, Brooklyn."
805236595209175040,2016-12-04 02:25:39,US statesman Mitt Romney said to be heartbroken at losing chance to lick the boots of abusive and foul-mouthed brag… https://t.co/ts1Lg6O7jN
805052428643172353,2016-12-03 14:13:50,"Foreign Ministry warns ""impudent puppy"" Donald Trump against further interference in internal affairs of Chinese peoples."
804745156796747777,2016-12-02 17:52:51,"Claims that United States San Bernardino killer was ""triggered"" by ""Christmas party"" lead Ministry of Culture to ban such parties in DPRK."
804744538132803584,2016-12-02 17:50:23,Banning of offensive arts in Russia is called wise and public spirited decision which will protect Russian peoples from terrorist attacks.
804741607627128837,2016-12-02 17:38:45,"Defeat of Gambia president Yahya Jammeh is called severe blow to African faith healers, alternative physicians, and… https://t.co/gMHngrTGj1"
804740065469591552,2016-12-02 17:32:37,"RT @DPRK_News: Donald Trump minister for war James Mattis is called ""Mad Dog,"" for his brutal executions of women and children while army g…"
804383550770479104,2016-12-01 17:55:57,"""Christmas"" is barbaric United States ceremony in which ""Santa Claus,"" demonic bringer of evil gifts to children, is ritually crucified."
804381141851668480,2016-12-01 17:46:23,"Miserable Costa Rica dismissed as nation of sun-loving, peace-worshipping simpletons, utterly unsuited to greatness in world affairs."
804377222509457409,2016-12-01 17:30:49,"Publication of ""Madame President"" issue by US newspaper Newsweek is gaffe akin to suggesting United States won Fatherland Liberation War."
804371664679092224,2016-12-01 17:08:44,"Russian president Vladimir Putin informs people that life has become better, life has become gayer, in address on state of federation."
804353036751687680,2016-12-01 15:54:42,"Disgusting Australian desire to grill ""shrimps on the barbecue"" is derided as ambition of little people, not destined for greatness."
804340286012977152,2016-12-01 15:04:02,"Ministry of Culture bans ""Disco"" music."
804337411190824960,2016-12-01 14:52:37,"Incoming finance minister Steven Mnuchin brings valuable experience in repossession and foreclosure, dominant US in… https://t.co/rnaEsBLMeM"
804333252257447936,2016-12-01 14:36:05,"Heroic donkey ""Uncle Kwon,"" of Chagang Province, receives recognition for identifying Japanese agents through his braying."
803984939192459264,2016-11-30 15:32:01,"US Footballers nonsensically derided by idiots for kneeling in reverence to US Flag. In DPRK, all athletes kneel in reverence to DPRK flag."
803875001560535041,2016-11-30 08:15:10,"Massive garbage fire in Nampo caused by reckless Italian Tourist, investigation determines."
803869555034439680,2016-11-30 07:53:31,"Wrestling mediocrity and failed butcher Eric Bischoff exposed as a drunken gerontophile, after attempting basic mathematics."
803820216249679872,2016-11-30 04:37:28,"Servile Donald Trump submits to US oligarch Willard Romney, in the fashion of a craven slave.

Marshal Kim Jong-Un… https://t.co/ECE8XUneO3"
803705424390168578,2016-11-29 21:01:19,DPRK DISMANTLES US 26-0 IN U-20 WOMENS WORLD CUP FINAL. HARMONY FIST FORMATION REMAINS UNDEFEATED IN INTERNATIONAL COMPETITION.
