id,created_at,text
878237607041404928,2017-06-23 13:05:37,"Woolly-headed Canadian fop Justin Trudeau amuses himself with sweater wearing unicorn puppet, whilst his nation wri… https://t.co/XaL4ij6Zch"
878235136101404674,2017-06-23 12:55:47,"Minister of State Security Sun Jang-Tae arrested as traitorous stooge, for taking three weeks to unravel meaning of… https://t.co/wUUBb61Al1"
878230958163537924,2017-06-23 12:39:11,"Traditional Korean opera, ""The Virtuous Young Ladies Of Traffic Enforcement Protect Workers From Themselves,"" is ca… https://t.co/46QUBfzubz"
877939309713608704,2017-06-22 17:20:17,Police constabulary of Sussex England is highly commended for application of Juche principles to eradication of hat… https://t.co/DO936IR3qE
877936394882097153,2017-06-22 17:08:42,"Failure of much anticipated Han Sulu film is attributed to creative differences, grasping appetite of US Disney cor… https://t.co/RuQORK60Cx"
877849220224385024,2017-06-22 11:22:18,"United States best selling book ""Understanding Trump"" by noted philanderer Newton Gingrich, is guide to finding hap… https://t.co/KT3HbmXQvy"
877846883917496320,2017-06-22 11:13:01,Vaunted subway trains of New York now gripped by breakdown and lawless anarchy. Pyongyang Metro delivers happy work… https://t.co/WEGSJc9RGV
877633077689929728,2017-06-21 21:03:26,"National Selfie Day is United States celebration of narcissistic onanism, in which depraved Americans show their mo… https://t.co/Y9hla6saYi"
877555016692879360,2017-06-21 15:53:14,"Saudi arabian king names own son as heir to throne, in disgusting act of nepotism bringing shame to his nation."
877530310459707393,2017-06-21 14:15:04,"Fruit picking season, for harvest of edible fruits and similar produce, is leading news item of the week. https://t.co/L7qILqDxP3"
876632999865004033,2017-06-19 02:49:28,New puppet south Korean foreign minister Kang Kyung-Hwa is denounced even before taking office.
876346652218593280,2017-06-18 07:51:38,"Horror at Wonsan beach ""clam digger"" party is averted, thanks to swift intervention by Supreme Leader Kim Jong-Un."
876308290162098179,2017-06-18 05:19:12,"City of Brooklyn, in United States, is last redoubt of once-terrifying bearded confederate revolutionary army. https://t.co/HdyEM1y9Wp"
876230711937835008,2017-06-18 00:10:55,"Production of second ""Flat-Liners"" film in past 30 years proves western culture to be in terminal and irrevocable s… https://t.co/o6qvQ0CWjW"
876192959842193408,2017-06-17 21:40:55,Father's day is United States holiday in which jobless children purchase neckties to repay their fathers for annual years rent of basements.
876163493648617474,2017-06-17 19:43:49,Persecution of United States  negro jazz singer Bing Crosby ends with jury sentenced to death by hanging. https://t.co/Txg9Bs2UFY
876160370163019779,2017-06-17 19:31:25,Esteemed General Kim Jong-Un. https://t.co/QdVAGiBLu9
876159466684731393,2017-06-17 19:27:49,Sternly worded letter from Marshal Kim Jong-Un convinces street mimes of Wonsan to mend their ways.
876157216138678272,2017-06-17 19:18:53,Midnight donkey racing in Nampo denounced as criminal conspiracy to terrorize the people.
876068959371636736,2017-06-17 13:28:11,"@DPRK_News now more followage than famed @FlatheadBeacon of Flathead, making @DPRK_News most trusted news source of Montana Province, US."
875877799797694464,2017-06-17 00:48:35,"Filthy and abominable New Yorkers of United States resort to games, in effort to make merry of distinguishing betwe… https://t.co/VWVHZu0LDE"
875743296513036288,2017-06-16 15:54:07,"Death of Helmut Kohl, German fuhrer best known for playing SPECTRE chief Ernst Blofeld in ""James Bond"" films, sadde… https://t.co/luCdgVbnpP"
875741611476611074,2017-06-16 15:47:25,"Sale of bonobos, gentle and placid apes of east Africa, to butcherous US Wal-Mart corporation proves the brutality… https://t.co/OPvS39YSAr"
875734770734571521,2017-06-16 15:20:14,Virtuous maidens and mothers agree: Red Banner Cigarettes of Democratic Peoples Republic of Korea promote maximum f… https://t.co/brj8bJNYY8
875634799381061632,2017-06-16 08:42:59,Ministry of Defence investigating whether top leader of so-called Islamic State killed by KPAF pilots during training mission over Syria.
875605481321938946,2017-06-16 06:46:29,"Rapturous applause at start of Pyongyang Fashion Week as Supreme Leader Kim Jong-Un declares ""red"" to be color of t… https://t.co/SzpJzK29e9"
875511613444550657,2017-06-16 00:33:29,INTERNATIONAL ARREST WARRANT IS ISSUED FOR CREATORS OF DISGUSTING AND ABHORRENT OBSCENITY IN VIOLATION OF ALL NORMS… https://t.co/tfS9xIuAem
875505330410672129,2017-06-16 00:08:31,Leading western tourism provider for young adventurers agrees: DPRK is safest and most wholesome destination for fo… https://t.co/YXrSAfsdsJ
875503659240607744,2017-06-16 00:01:53,"Marshal Kim Jong-Un donates honorary copy of Donald Trump ""Art of Deal"" to Pyongyang parrot conservatory. https://t.co/24yXefcNio"
875406067643166729,2017-06-15 17:34:05,"Terrified denizens of US city Los Angeles to shine signal to false god ""Bat Man,"" in prayer for relief from vengean… https://t.co/6IWqQ7ULNd"
875399983285104640,2017-06-15 17:09:54,"Supreme Leader Kim Jong-Un captures rogue 8 meter Chinese Leatherback Crocodile on shores of Imjin River, to great… https://t.co/NwpdyeroS0"
875395561876328448,2017-06-15 16:52:20,US basketball hit by scandal as leading coach Rick Pitino is revealed to be shameful pimp. Only Dennis Rodman remai… https://t.co/lYutLhyoUH
875377165348605952,2017-06-15 15:39:14,"US computer company Twitter changes displays to clownish bubbles and circles, to comfort users traumatized by horror of their daily lives."
874613215396851712,2017-06-13 13:03:34,Supreme Leader Kim Jong-Un mediation of international Qatar crisis delayed by arrival of eminent personage Dennis Rodman in Pyongyang.
874610204419260416,2017-06-13 12:51:36,Return of the King. https://t.co/wxgslVTTHi
874147025096495105,2017-06-12 06:11:06,"""Mummy,"" by US senator from Canada Ted Cruise, is named worst film of already horrific film career. https://t.co/XET7PpEMZw"
873693461936996357,2017-06-11 00:08:48,"Adam West is pronounced leading Bat Man of modern era, due to rigid ideological correctness and wholesome demeanor… https://t.co/FHhYUswTQk"
873610593500098560,2017-06-10 18:39:31,"Atrocious United States human sow Lena Dunham is warned, once again, that interference in Korean peninsular affairs… https://t.co/Gnejc4p3Yb"
873323961576079360,2017-06-09 23:40:32,"DPRK Programmers develop algorithm predicting paths of large objects through atmosphere.

US Programmers model physics of women's breasts."
873277746096594944,2017-06-09 20:36:54,"77% of western workers now replaced by robots, according to latest findings. https://t.co/vBoI931wK8"
873274727623671809,2017-06-09 20:24:54,Noted Impotent Russophile Donald Trump feebly attempts to twart investigation by volunteering to defiantly perjure… https://t.co/bnMNlCK2FE
873273212741791744,2017-06-09 20:18:53,Source of orange dust encrusting face of United States Chief Warlord Donald Trump continues to elude leading scient… https://t.co/BBr3JIWymn
873271085713719297,2017-06-09 20:10:26,United States fascists warned: interference in internal affairs of Puerto Rico will bring devastating consequences.
873256453309702148,2017-06-09 19:12:17,"Donald Trump to file lawsuit against secret police chief for vicious slanders.

Marshal Kim Jong-Un has never been… https://t.co/CUhvzlc3vK"
873255279231733760,2017-06-09 19:07:37,"Black Panther, story of revolutionary US negro political leader Huey P Newton, is first ""Marvel Superhero"" film app… https://t.co/nT0967dIEl"
873236769885630465,2017-06-09 17:54:04,"Foreign Ministry adds England to list of states supporting terrorism, as vicious orange hooligans of Northern Irela… https://t.co/2qMPKFAbV3"
873166694491049988,2017-06-09 13:15:37,"Failure by Teresa May to secure majority government heralds new dark age for England, leading scholars say. https://t.co/zQullSkhNZ"
873146892540096512,2017-06-09 11:56:56,True winner of disastrous English election contest is said to be Esteemed General Kim Jong-Un. https://t.co/JGWld9CkjN
873137619038867457,2017-06-09 11:20:05,"""E3"" is United States government plan for mass roundup and disposal of computer addicts, game writers, and similar… https://t.co/tJtDGH5o4D"
873134774826782721,2017-06-09 11:08:47,Pyongyang Sunan International Airport overrun by English bankers seeking to exchange worthless pounds for Won.
873051647173251073,2017-06-09 05:38:27,"After incorrect statistical prediction in UK Election, English Idiot Piers Morgan derided as a filthy hog, eating f… https://t.co/m0oZFdsBcJ"
872976805493219328,2017-06-09 00:41:04,Kim Il Sung University Institute for Advancement in Artificial Intelligence does not exist.
872970116790534146,2017-06-09 00:14:29,"US National Socialists torn between their deep love of Secret Police and Bulbous Shouting Baboon Donald Trump, reso… https://t.co/0XzzH8M8Mv"
872966092586590208,2017-06-08 23:58:30,Wrong polling results in British elections result of overreliance on inaccurately perverse statisticians and reliance on Bayesian Ideology.
872957733045194753,2017-06-08 23:25:16,"As exit polls show lead for English communist Jeremy Corbyn, capitalists of London pray to their gods for protectio… https://t.co/ZM0Yai1CP5"
872912752871952384,2017-06-08 20:26:32,"Esteemed United States reporter shows Americans match Japanese pornographers for disgustingness.

Tentacle pornogra… https://t.co/99E54c7yPV"
872875303240163329,2017-06-08 17:57:44,Ignorance of United States journalists is proven. Only @DPRK_News provides full and fair coverage of United States… https://t.co/4CpPTSsAZ5
872866610201190400,2017-06-08 17:23:11,"US senator John McCain blathers endlessly concerning matters of small importance, as his nation destroys itself. https://t.co/Di8AGJmQxH"
872834921227833345,2017-06-08 15:17:16,"English communist Jeremy Corbyn pledges to deliver electoral victory, ""for all of the ladies in the house."" https://t.co/jLBbRTwS5g"
872827542885076993,2017-06-08 14:47:57,"Syphilitic and abhorrent murderer James Comey, infamous pawn of globalist imperialist Illuminati, complains of defamation by Donald Trump."
872820261988511745,2017-06-08 14:19:01,@DPRK_News correspondent at Union Pub in Washington DC reports uncontrolled and uproarious laughter at self-important imbecility of US press
872805296166588416,2017-06-08 13:19:33,"US secret police chief James Comey expected to testify against Donald Trump assisted by anatomically correct doll,… https://t.co/4N8QczYZdw"
872802403107700736,2017-06-08 13:08:03,"Capital city of Myanmar is Nay Pyi Taw, despite all evidence to the contrary."
872658997748187136,2017-06-08 03:38:12,"Noted Pervert Trump demands loyalty like scared girl ineffectually making demands of an absent father.

Marshall Ki… https://t.co/DuntQzIwZb"
872651130961973249,2017-06-08 03:06:57,Italy-Korea Noodle Friendship Dinner is canceled after uncouth guests threw noodles at hosts over minor disagreements.
872589787932364801,2017-06-07 23:03:12,South Korean military mice awed by launch of multiple rockets by victorious Korean Peoples Army.
872534269016649729,2017-06-07 19:22:35,Failure by south Korean puppets to defeat miserable Italians in football shows stunted degeneration of once mighty… https://t.co/f8bB3SV1wX
872530602540621824,2017-06-07 19:08:01,"Top concerns for English voters said to be dearth of new reality television programs, price of ""Marmite"" and simila… https://t.co/w4AcUox2vI"
872528200882163712,2017-06-07 18:58:28,Supreme Leader Kim Jong-Un takes request to mediate between Qatar and Saudi Arabia under most serious consideration.
872526273712672769,2017-06-07 18:50:49,"Democratic Peoples Republic of Korea said to employ more police than all other nations, guaranteeing safety from so-called Islamic state."
872523657553346560,2017-06-07 18:40:25,Multiple US spy chiefs testify to inappropriate gropings by US lecher in chief and internationally noted pervert Do… https://t.co/uTfwU562zJ
872349822375866368,2017-06-07 07:09:39,"All translated copies of ""Pippi Longstocking"" destroyed in schools across DPRK, after being deemed too pornographic for children."
872344843825147904,2017-06-07 06:49:52,"""Curry Burning with Revolutionary Fervor"" wins Spicy Food Contest in Haeju.  Last place was Disqualified British dish ""Oatmeal""."
872284034352660480,2017-06-07 02:48:14,"In update of previous item, lost luggage in Pyongyang International Airport found to be full of tapioca pudding, and therefore discarded."
872282258064818177,2017-06-07 02:41:11,Vicious US Government falls into disarray as Racist Hobgoblin Jeffrey Sessions threatens to resign over inability t… https://t.co/VFikOpVZx4
872237903363047424,2017-06-06 23:44:56,"As victory looms for English communists, capitalists of London prepare themselves for the Harvest. https://t.co/wjcdUN80EI"
872090591819157504,2017-06-06 13:59:34,"""Hippopotamus,"" national beast of Sudan, is known for savage attacks upon crocodiles."
872088837408915456,2017-06-06 13:52:36,"Outbreak of avian influenza in south Korea is called ""bird flu"" by ignorant and uneducated westerners."
872087341384577026,2017-06-06 13:46:39,Supreme Leader Kim Jong-Un renews pledge of democratic friendship with peoples of Qatar.
872067894053662723,2017-06-06 12:29:22,Joyous French personages celebrate anniversary of Great Leader Kim Il-Sung landing at Normandy to rescue Europe from fascist oppressions.
871904754250731520,2017-06-06 01:41:07,"Ultimate ""reality winner"" is Esteemed General Kim Jong-Un."
871768073006714885,2017-06-05 16:37:59,"Supreme Leader Kim Jong-Un ""bares all"" concerning increased production of turnips in interview with world famed spo… https://t.co/U9SFGxEu2T"
871765694324625409,2017-06-05 16:28:32,"Ban on Christian tourists to DPRK is now called ""Anti-United States Terrorist Travel Order,"" following latest ruling by DPRK Central Court."
871763305563643904,2017-06-05 16:19:03,15 admissions to Kim Il-Sung University revoked due to inappropriate social media commentary on agricultural policy.
871753231411552256,2017-06-05 15:39:01,"Italian Tourist released from Burn Unit after foolishly attempting to sample ""Juche Chili"" without appropriate training."
871745709472702464,2017-06-05 15:09:08,"As trial of US jazz singer Bing Crosby begins, progressive world peoples condemn United States for wanton oppressio… https://t.co/cf5zqWUbkd"
871743990051336193,2017-06-05 15:02:18,"""Let Us Crush All Foreign Superstitions"" Campaign of Marshal Kim Jong-Un called remarkable success at preventing radical Islamic terrorism."
871192784585281536,2017-06-04 02:32:00,"Supreme Leader Kim Jong-Un declines to coach Golden State against Cleveland Cavaliers, citing long friendship with Steve Kerr."
871175418673594368,2017-06-04 01:23:00,"""Doctor Who"" denounced as effete English fop, known only for ridiculous scarfs."
871168441385795584,2017-06-04 00:55:16,"RT @DPRK_News: Western cinema dominated by film concerning exploits of lingerie-clad harlot, erotically binding fascists with rope."
871051419905921027,2017-06-03 17:10:16,"""Deplorable"" is top name for sub-normal and otherwise defective children in United States, according to leading web home page Twitter."
871050743683440640,2017-06-03 17:07:35,"Most popular spice of France, famed for its culinary prowess, is pepper."
871048910353178624,2017-06-03 17:00:18,Ministry of Tourism revokes entry visa of US celebrity cocaine addict Bill Meyer for excessive use of anti-negro slurs.
871046772940046336,2017-06-03 16:51:48,"Supreme Leader Kim Jong-Un to be interviewed by glamorous reporteress Megan Kelly, concerning affection for kittens… https://t.co/PKmcrfhxGk"
871044320362545152,2017-06-03 16:42:03,"Center for Revolutionary Studies in Kim Il Sung University finds US ""resistance"" composed of effete idiots with no desire to fight or vote"
870703517484302337,2017-06-02 18:07:50,"Supreme Leader Kim Jong-Un detects gravitational waves for third time, in major advance for science of physic."
870693220321116160,2017-06-02 17:26:55,Complaint by self-promoting vulgarian of destruction by Donald Trump garners little sympathy from Trump bombing vic… https://t.co/9MMUwEgDkC
870680979706322945,2017-06-02 16:38:16,"75th birthday of CIA joyously celebrated in Washington.

Celebrations in Chile, Guatemala, Cambodia, and Iran said to be more restrained."
870676092310499328,2017-06-02 16:18:51,"US mothers urged by New York Times to raise emasculated feminine boys.

@DPRK_News rouses Korean mothers to raise s… https://t.co/3EcT3DuByT"
870652282039398401,2017-06-02 14:44:14,"Trial begins to decide whether US McDonald hamburger sandwiches are formed of healthful beef or, as scholars conten… https://t.co/BYMqtaJX3a"
870644045353279489,2017-06-02 14:11:30,"""National Doughnut Day"" sees grotesque Americans endlessly gorging selves on disgusting confections of lard, dough, and flavorless jellies."
870619560508092416,2017-06-02 12:34:13,"Sale of posters and lower back tattoos featuring ""hunky"" Jeremy Corbyn surges among English girls attracted by rese… https://t.co/0CK4jQb7ul"
870617072006561792,2017-06-02 12:24:19,"DPRK said to enjoy strictest climate protection, hard-working and educated labor force, for industry relocating from faithless United States"
870615314668687361,2017-06-02 12:17:20,"Western craze for ""mullet,"" hair styling of affluent war lords and rich sub-urban cave men, continues without no en… https://t.co/n8jNyBGfjV"
870380623122362368,2017-06-01 20:44:46,Supreme Leader Kim Jong-Un announces refusal to negotiate new climate treaty with deranged and vicious cretin Donald Trump.
870312496292392960,2017-06-01 16:14:03,"US oligarch Hillary Clinton assailed as witless drunkard for ignoring province of Wisconsin.

Marshal Kim Jong-Un a… https://t.co/xwDQ6xPb8s"
869959077790613505,2017-05-31 16:49:41,"Esteemed General Kim Jong-Un renews DPRK assent to Paris climate accords, for protection of weather."
869957804823654400,2017-05-31 16:44:38,Solar eclipse across United States is said to herald doom for globalist imperialism.
869902334708649984,2017-05-31 13:04:13,"Arrest order issued against US pornographer Kathy Griffin and 47386 ""Twitter"" customers, for unspeakable desecrations of Marshal Kim Jong-Un"
869808033853054976,2017-05-31 06:49:30,"DEVELOPING: Meaning of term ""covfefe"" remains under analysis by Ministry of State Security.

This story will be updated as events transpire."
869806856436371458,2017-05-31 06:44:49,"Korean language has over 100 words describing colours.

Brutish English speakers are forced to use ""orange"" to describe colour, and fruit."
869791212135260160,2017-05-31 05:42:39,Fat Warlord Donald Trump tragically and hilariously has stroke while being angry on Internet Technology. https://t.co/GsBxSr81FR
869606642857504768,2017-05-30 17:29:14,Supreme Leader Kim Jong-Un receives gift of alpine mountain floral basket from Swiss Franco-Italian Society for Study of Juche Idea.
869605013336846336,2017-05-30 17:22:46,"Anti-capitalist statue. of high moral significance, depicts Furious Otter of Juche warning Starving Peasant Girl to… https://t.co/DMoERbO507"
869601560371888129,2017-05-30 17:09:03,"KCNA revival of ""Love Connection"" is cancelled, due to disgraceful ignorance of creator Chuck Woollery concerning origins of communism."
869575499978342400,2017-05-30 15:25:29,"Fascination of fascist leaders with orb necromancy continues.

Only Supreme Leader Kim Jong-Un possesses true and m… https://t.co/8Tk5jZurkS"
869561969396809728,2017-05-30 14:31:43,"Western cinema dominated by film concerning exploits of lingerie-clad harlot, erotically binding fascists with rope."
869553561490817024,2017-05-30 13:58:19,Death of Panamanian drug pusher Manuel Noriega in prison proves the bitter fruits of CIA stoogedom. https://t.co/507p8bhV5G
869550800930037760,2017-05-30 13:47:21,"Flailing ineptitude of Donald Trump shown, as communication manager resigns.

No Marshal Kim Jong-Un communication… https://t.co/FFRmDyvTRR"
869181540412084224,2017-05-29 13:20:02,Staggering incompetence of English air midgets strands thousands of terrified passengers in desolate hellholes such as Glasgow and Luton.
869178080979496962,2017-05-29 13:06:17,Latest ballistic missile test sees Japanese cretins soaking in the urine of cowardice and shame.
869175278047723520,2017-05-29 12:55:09,"Supreme Leader Kim Jong-Un, forgetting own strength, accidentally breaks wrist of Laotian foreign minister during diplomatic handshake."
868689813662081026,2017-05-28 04:46:05,"Bulbous Imbecile Duterte overcompensates for flaccid sexual prowess once again, bragging about Filipino soldiers ra… https://t.co/PtXhBCmAgw"
868606340180000768,2017-05-27 23:14:24,"Supreme Leader Kim Jong Un in photo-still from upcoming musical video ""To all with Hate in their Hearts: Juche is f… https://t.co/v8qm446mOm"
868492283477467137,2017-05-27 15:41:10,"Late US security adviser, known to world as Zbigniev Brzezinski, remembered for opposition to Great Leader Kim Il-Sung and ridiculous name."
868491250609139712,2017-05-27 15:37:04,Death of Zbigniev Brzezinski is expected to increase ease of Latin alphabet spelling bees by 37%.
868410781708283904,2017-05-27 10:17:19,"Marshal Kim Jong-Un to break fast with eggs, bacon, sausages, and celebratory toast of brandy in honor of world Muslim holiday of Ramadan."
868224034219188224,2017-05-26 21:55:15,"Marshal Kim Jong-Un, after four private screenings of scandalous ""Bay Watch"" movie, orders film suppressed for mora… https://t.co/rHfsTheD6M"
868215408188379136,2017-05-26 21:20:58,Western culture expected to destroy itself at any moment. https://t.co/Xh96oaRnEJ
868212768230580225,2017-05-26 21:10:29,"Donald Trump warned to keep his filthy trap shut and decease all further anti-DPRK slanders, lest he invite global… https://t.co/xWDFn3JWz3"
868146796257849350,2017-05-26 16:48:20,"English junta leader Theresa May is secures endorsement as most fashionable dictator of Europe, ahead of upcoming r… https://t.co/e9INolzjsG"
868143998258610176,2017-05-26 16:37:13,"Hard work and preparation brings Marshal Kim Jong-Un victory at Pyongyang Chilli Dog Eating contest, with record 167 Chilli dogs devoured."
868140308789415936,2017-05-26 16:22:33,"US oligarch Hillary Clinton is commended by leading aesthetes and personages of fashion, for respectful homage to G… https://t.co/H1UWAL88E1"
868132444561690624,2017-05-26 15:51:18,Supreme Leader Kim Jong-Un is named Best Dressed Man in Democratic Peoples Republic of Korea for 15th consecutive y… https://t.co/BoPsV5rs63
868129126548250624,2017-05-26 15:38:07,"""World comeback tour"" by US blues singer ""Smash Mouth"" is aborted at Pyongyang Music Hall, due to lyrical incoherence and obnoxiousness."
868126844410884097,2017-05-26 15:29:03,"In case of assault on rude Italian reporter Marshal Kim Jong-Un defeats all charges, bringing judges to tears in he… https://t.co/CbV9uibXgu"
868102511302934528,2017-05-26 13:52:21,"Supreme Leader Kim Jong-Un's second cousin Kim Il-Nam is named ""person of interest"" in case of treason, and ideological right deviationism."
867860225776164865,2017-05-25 21:49:36,"Insecure diaper-man Trump quotes ""approval rating"" of 48% in attempt to boost flaccid ego. 
Marshall Kim Jong-Un en… https://t.co/mS7t9gRxFL"
867787185201659908,2017-05-25 16:59:22,Marshal Kim Jong-Un denies strangling Italian reporter for asking impertinent questions. Leader merely placed hands around reporter's neck.
867759680025763840,2017-05-25 15:10:04,"Chinese manned submersible descends to 6300 meters below ocean depths.

Deepest DPRK submersible descent to date is 63000 meters."
867756967934218241,2017-05-25 14:59:17,"Donald Trump admonishes NATO weakling allies for poor defence spending.

Democratic Peoples Republic of Korea spends 23% of GDP on defence."
867753600881184772,2017-05-25 14:45:55,"RT @DPRK_News: ""Star Wars"" is science fiction tale of lazy peasant, whose neglect of agricultural quotas leads to destruction of his friend…"
867747547250642944,2017-05-25 14:21:51,Bonds of friendship between Democratic Peoples Republic of Korea and Republic of Turkmenistan can never be broken.
867735348113272834,2017-05-25 13:33:23,"Survey shows top method of political dispute resolution in US is hitting people.

DPRK disputes resolved through fatherly love and consensus"
867730919985119232,2017-05-25 13:15:47,"Impertinent Italian reporter suffers ""Red Tiger"" taekwondo strike from Supreme Leader Kim Jong-Un, for questioning… https://t.co/qhuVKvurZP"
867723682671730688,2017-05-25 12:47:02,"Elections for US parliament take place in Montana province, known for its rustic beauty, and tradition of savagely attacking news reporters."
867634567183728640,2017-05-25 06:52:55,"Artificial intelligence likely to model the mind of Supreme Leader Kim Jong-Un, according to leading computer science professionals."
867409936384499717,2017-05-24 16:00:19,Memorial Day is US holiday on which dead and wounded soldiers are remembered through pollution of beaches with empt… https://t.co/MI9KgGiavJ
867408028294926336,2017-05-24 15:52:44,"Uproarious television clown Sean Hannity amuses millions with apology, in the fashion of a simpering slave, to fami… https://t.co/qkc21loAF1"
867395429952090114,2017-05-24 15:02:40,"Repugnant oaf Donald Trump shares tales of US submarines with murderous human pizza Rodrigo Duterte.

All are known… https://t.co/UXtVb7vz0a"
